{
  "id": "gearwise",
  "appName": "Gearwise Maintenance",
  "wordmark": { "text": "gearwise", "suffix": ".mx" },
  "platform": "gearwise",
  "tagline": "Example white-label brand for the maintenance assistant template — replace or delete.",
  "fonts": { "display": "Manrope", "mono": "DM Mono" },
  "colors": {
    "light": { "accent": "#B45309", "accent2": "#92400E", "onAccent": "#FFFFFF" },
    "dark": { "accent": "#FBBF24", "accent2": "#F59E0B", "onAccent": "#271A03", "bg": "#0F0C07", "bg2": "#17130B", "bg3": "#201A10", "border": "#2E2516", "border2": "#3D3220", "err": "#F87171" }
  },
  "tabs": ["services", "edge", "agent", "grafana"],
  "links": [{ "label": "Template README", "url": "https://github.com/raisga/p4n4-templates/tree/main/projects/mqtt-influx-grafana-ollama-letta" }],
  "defaults": {
    "host": "localhost",
    "themeMode": "light",
    "normieTabs": "agent,grafana",
    "agentBackend": "letta"
  },
  "native": {
    "displayName": "Gearwise",
    "applicationId": "com.example.gearwise.maintenance",
    "bundleId": "com.example.gearwise.maintenance",
    "company": "Gearwise Plant Services (example)",
    "localNetworkUsage": "Connects to your machines' sensors, dashboards and maintenance assistant on the local network."
  }
}
